{
  "$schema": "https://json-schema.org/draft/2020-12/schema",
  "$id": "https://example.com/formats.schema.json",
  "title": "Formats",
  "description": "A JSON schema exercising every ajv-formats format",
  "type": "object",
  "properties": {
    "date": { "type": "string", "format": "date" },
    "time": { "type": "string", "format": "time" },
    "dateTime": { "type": "string", "format": "date-time" },
    "isoTime": { "type": "string", "format": "iso-time" },
    "isoDateTime": { "type": "string", "format": "iso-date-time" },
    "duration": { "type": "string", "format": "duration" },
    "uri": { "type": "string", "format": "uri" },
    "uriReference": { "type": "string", "format": "uri-reference" },
    "uriTemplate": { "type": "string", "format": "uri-template" },
    "url": { "type": "string", "format": "url" },
    "email": { "type": "string", "format": "email" },
    "hostname": { "type": "string", "format": "hostname" },
    "ipv4": { "type": "string", "format": "ipv4" },
    "ipv6": { "type": "string", "format": "ipv6" },
    "regex": { "type": "string", "format": "regex" },
    "uuid": { "type": "string", "format": "uuid" },
    "jsonPointer": { "type": "string", "format": "json-pointer" },
    "relativeJsonPointer": {
      "type": "string",
      "format": "relative-json-pointer"
    },
    "byte": { "type": "string", "format": "byte" },
    "int32": { "type": "integer", "format": "int32" },
    "int64": { "type": "integer", "format": "int64" },
    "float": { "type": "number", "format": "float" },
    "double": { "type": "number", "format": "double" },
    "password": { "type": "string", "format": "password" },
    "binary": { "type": "string", "format": "binary" }
  },
  "required": [
    "date",
    "time",
    "dateTime",
    "isoTime",
    "isoDateTime",
    "duration",
    "uri",
    "uriReference",
    "uriTemplate",
    "url",
    "email",
    "hostname",
    "ipv4",
    "ipv6",
    "regex",
    "uuid",
    "jsonPointer",
    "relativeJsonPointer",
    "byte",
    "int32",
    "int64",
    "float",
    "double",
    "password",
    "binary"
  ]
}
