{
  "date": "2026-08-23",
  "time": "14:22:00Z",
  "dateTime": "2026-08-23T14:22:00Z",
  "isoTime": "14:22:00",
  "isoDateTime": "2026-08-23T14:22:00",
  "duration": "P1Y2M3DT4H5M6S",
  "uri": "https://example.com/path",
  "uriReference": "/relative/path",
  "uriTemplate": "https://example.com/{id}",
  "url": "https://example.com",
  "email": "user@example.com",
  "hostname": "example.com",
  "ipv4": "192.168.1.1",
  "ipv6": "2001:db8::1",
  "regex": "^[a-z]+$",
  "uuid": "123e4567-e89b-12d3-a456-426614174000",
  "jsonPointer": "/foo/bar",
  "relativeJsonPointer": "1/foo",
  "byte": "aGVsbG8=",
  "int32": 100,
  "int64": 123456789012,
  "float": 1.5,
  "double": 1.5,
  "password": "p@ssw0rd",
  "binary": "binarydata"
}
